{
  "$id": "https://www.agentobjectmodel.org/spec/v0.1.0/aom-input-schema.json",
  "$schema": "https://json-schema.org/draft/2020-12/schema",
  "title": "Agent Object Model (AOM) Input Schema",
  "description": "Core schema for representing an interactive surface (screen, modal, panel, widget, drawer) in a task- and entity-centric JSON format for AI agents. When the surface declares agent identity requirements, the agent must include agent_id (and optionally agent_name) in the request it sends to the site when invoking an action.",
  "version": "0.1.0",
  "type": "object",
  "required": [
    "automation_policy",
    "aom_version",
    "surface_id",
    "surface_kind",
    "generated_at",
    "purpose",
    "context",
    "tasks",
    "entities",
    "actions",
    "state",
    "navigation",
    "signals"
  ],
  "properties": {
    "automation_policy": {
      "type": "string",
      "enum": ["allowed", "forbidden", "open"],
      "description": "Agent automation policy for this surface. forbidden = no automation; allowed = READY/guardrailed; open = permissive.",
      "default": "allowed"
    },
    "aom_version": {
      "type": "string",
      "description": "Version of the AOM spec this document conforms to.",
      "examples": ["0.1.0"]
    },
    "surface_id": {
      "type": "string",
      "description": "Stable identifier for this surface in the format app:section:screen.",
      "examples": ["alpha_trade:order_entry:equities"]
    },
    "surface_kind": {
      "type": "string",
      "enum": ["screen", "modal", "panel", "widget", "drawer"],
      "description": "Kind of surface this AOM document represents."
    },
    "generated_at": {
      "type": "string",
      "format": "date-time",
      "description": "Timestamp when this AOM document was generated (ISO 8601)."
    },
    "generator": {
      "type": "object",
      "description": "Information about the component that generated this AOM document.",
      "properties": {
        "name": {
          "type": "string",
          "description": "Name of the generator (browser extension, plugin, runtime)."
        },
        "version": {
          "type": "string",
          "description": "Version of the generator."
        }
      },
      "additionalProperties": false
    },
    "calling_agent": {
      "type": "object",
      "description": "Optional agent requesting this AOM surface. When present (e.g. echoed by the server), identifies who is calling. When the surface requires agent identity on submit, the agent MUST include agent_id (and optionally agent_name) in the action-invocation request; standard field names are agent_id and agent_name.",
      "properties": {
        "agent_id": {
          "type": "string",
          "description": "Registry UUID or identifier for the agent."
        },
        "agent_name": {
          "type": "string",
          "description": "Human-readable agent name."
        },
        "key_issuer": {
          "type": "string",
          "description": "Issuer of agent_id (e.g. 'aom.tools')."
        },
        "agent_id_required": {
          "type": "boolean",
          "description": "If true, when the agent submits a request on this site it MUST include agent_id in the request. Optional today; may become mandatory as ecosystem matures."
        },
        "agent_name_required": {
          "type": "boolean",
          "description": "If true, when the agent submits a request on this site it MUST include agent_name in the request."
        }
      },
      "additionalProperties": false
    },
    "purpose": {
      "type": "object",
      "required": ["primary_goal", "user_roles"],
      "properties": {
        "primary_goal": {
          "type": "string",
          "description": "One-line description of the primary purpose of this surface."
        },
        "user_roles": {
          "type": "array",
          "items": {
            "type": "string"
          },
          "description": "Roles expected to use this surface."
        }
      },
      "additionalProperties": false
    },
    "context": {
      "type": "object",
      "required": ["app_name", "locale"],
      "properties": {
        "app_name": {
          "type": "string",
          "description": "Human-readable name of the host application."
        },
        "tenant_id": {
          "type": "string",
          "description": "Tenant or account identifier, if applicable."
        },
        "locale": {
          "type": "string",
          "description": "IETF BCP 47 language tag for the current locale.",
          "examples": ["en-US"]
        }
      },
      "additionalProperties": true
    },
    "tasks": {
      "type": "array",
      "description": "Explicit tasks this surface supports.",
      "items": {
        "type": "object",
        "required": ["id", "label", "description"],
        "properties": {
          "id": {
            "type": "string",
            "description": "Stable identifier for this task."
          },
          "label": {
            "type": "string",
            "description": "Short human-readable label for this task."
          },
          "description": {
            "type": "string",
            "description": "Detailed description of what this task does."
          },
          "default_action_id": {
            "type": "string",
            "description": "Default action identifier for this task (optional)."
          },
          "input_entities": {
            "type": "array",
            "items": {
              "type": "string"
            },
            "description": "Names of entities required as inputs for this task."
          },
          "output_entities": {
            "type": "array",
            "items": {
              "type": "string"
            },
            "description": "Names of entities produced or updated by this task."
          },
          "entry_actions": {
            "type": "array",
            "items": {
              "type": "string"
            },
            "description": "Action identifiers that typically start this task."
          },
          "success_conditions": {
            "type": "array",
            "items": {
              "type": "string"
            },
            "minItems": 1,
            "description": "Conditions that indicate successful completion of this task."
          },
          "failure_conditions": {
            "type": "array",
            "items": {
              "type": "string"
            },
            "description": "Conditions that indicate failure of this task."
          }
        },
        "additionalProperties": false
      }
    },
    "entities": {
      "type": "object",
      "description": "Named domain entities relevant to this surface. Keys are entity names.",
      "additionalProperties": {
        "type": "object",
        "required": ["schema"],
        "properties": {
          "schema": {
            "type": "object",
            "description": "Field definitions for this entity. Keys are field names.",
            "additionalProperties": {
              "type": "object",
              "properties": {
                "type": {
                  "type": "string",
                  "enum": ["string", "number", "boolean", "enum", "array", "object"],
                  "description": "Primitive type of this field."
                },
                "required": {
                  "type": "boolean",
                  "description": "Whether this field is required for the entity to be valid."
                },
                "required_if": {
                  "type": "object",
                  "description": "Optional conditional requirements expressed as a map of field -> value."
                },
                "values": {
                  "type": "array",
                  "items": {
                    "type": "string"
                  },
                  "description": "Allowed values for enum types."
                },
                "min": {
                  "type": "number",
                  "description": "Minimum value for numeric fields."
                },
                "max": {
                  "type": "number",
                  "description": "Maximum value for numeric fields."
                },
                "description": {
                  "type": "string",
                  "description": "Human-readable description of this field."
                },
                "validation": {
                  "type": "object",
                  "description": "Optional validation rules (pattern, min_length, max_length, custom_rule).",
                  "additionalProperties": true
                }
              },
              "additionalProperties": false
            }
          },
          "current": {
            "description": "Current value or instance of the entity at this surface.",
            "type": ["object", "array", "string", "number", "boolean", "null"]
          },
          "schema_org_type": {
            "type": "string",
            "description": "Optional schema.org type this entity maps to.",
            "examples": ["schema:Product"]
          }
        },
        "additionalProperties": false
      }
    },
    "actions": {
      "type": "array",
      "description": "Actions that can be performed from this surface.",
      "items": {
        "type": "object",
        "required": ["id", "label", "category"],
        "properties": {
          "id": {
            "type": "string",
            "description": "Stable identifier for this action."
          },
          "label": {
            "type": "string",
            "description": "Short human-readable label for this action."
          },
          "category": {
            "type": "string",
            "description": "High-level category for this action (navigation, mutation, export)."
          },
          "description": {
            "type": "string",
            "description": "Detailed description of what this action does."
          },
          "priority": {
            "type": "number",
            "minimum": 0,
            "maximum": 10,
            "default": 5
          },
          "method": {
            "type": "string",
            "enum": ["GET", "POST", "PUT", "PATCH", "DELETE"]
          },
          "input_entities": {
            "type": "array",
            "items": {
              "type": "string"
            },
            "description": "Names of entities used as inputs to this action."
          },
          "output_entities": {
            "type": "array",
            "items": {
              "type": "string"
            },
            "description": "Names of entities that this action may create or update."
          },
          "effects": {
            "type": "array",
            "description": "Expected side-effects of this action, expressed in natural language.",
            "items": {
              "type": "string"
            }
          },
          "binds_to": {
            "type": "object",
            "description": "Optional binding to an external workflow or tool definition.",
            "properties": {
              "type": {
                "type": "string",
                "description": "Type or namespace of the external binding (e.g., agents.json.workflowStep)."
              },
              "ref": {
                "type": "string",
                "description": "External reference identifier."
              },
              "optional": {
                "type": "boolean",
                "description": "Whether this binding is optional.",
                "default": false
              }
            },
            "additionalProperties": false
          },
          "a2h_policy": {
            "type": "object",
            "description": "Agent-to-Human (A2H) policy for this action. Overrides surface a2h when set.",
            "properties": {
              "requires_authorization": { "type": "boolean", "default": false },
              "confidence_threshold": { "type": "number", "minimum": 0, "maximum": 1 },
              "intent_type": { "type": "string", "enum": ["INFORM", "COLLECT", "AUTHORIZE", "ESCALATE", "RESULT"] },
              "escalation_channel": { "type": "string", "enum": ["in_app", "sms", "email", "push", "voice"] }
            },
            "additionalProperties": false
          }
        },
        "additionalProperties": false
      }
    },
    "state": {
      "type": "object",
      "description": "State flags and values for this surface.",
      "properties": {
        "session": {
          "type": "object",
          "description": "Session-related state such as authentication.",
          "properties": {
            "authenticated": {
              "type": "boolean",
              "description": "Indicates whether the user is authenticated.",
              "default": false
            },
            "user_id": {
              "type": ["string", "null"],
              "description": "Identifier of the current user, if known."
            }
          },
          "additionalProperties": true
        },
        "workflow": {
          "type": "object",
          "description": "Information about the current position within a workflow.",
          "properties": {
            "flow_id": { "type": ["string", "null"] },
            "task_id": { "type": ["string", "null"] },
            "step_id": { "type": ["string", "null"] }
          },
          "additionalProperties": true
        },
        "flags": {
          "type": "object",
          "description": "Additional boolean flags describing state (e.g., read_only).",
          "additionalProperties": {
            "type": "boolean"
          }
        }
      },
      "additionalProperties": true
    },
    "navigation": {
      "type": "object",
      "description": "Navigation options available from this surface.",
      "properties": {
        "breadcrumbs": {
          "type": "array",
          "description": "Ordered list of navigation steps leading to this surface.",
          "items": {
            "type": "object",
            "properties": {
              "label": { "type": "string" },
              "surface_id": { "type": "string" }
            },
            "additionalProperties": false
          }
        },
        "neighbors": {
          "type": "array",
          "description": "Other surfaces that are directly reachable from this one.",
          "items": {
            "type": "object",
            "properties": {
              "surface_id": { "type": "string" },
              "label": { "type": "string" }
            },
            "additionalProperties": false
          }
        }
      },
      "additionalProperties": true
    },
    "a2h": {
      "type": "object",
      "description": "Surface-level Agent-to-Human (A2H) policy. Optional.",
      "properties": {
        "confidence_threshold": { "type": "number", "minimum": 0, "maximum": 1 },
        "default_intent_type": { "type": "string", "enum": ["INFORM", "COLLECT", "AUTHORIZE", "ESCALATE", "RESULT"] },
        "escalation_channel": { "type": "string", "enum": ["in_app", "sms", "email", "push", "voice"] }
      },
      "additionalProperties": false
    },
    "signals": {
      "type": "object",
      "description": "Errors, warnings, and notifications present on this surface.",
      "properties": {
        "errors": {
          "type": "array",
          "items": { "type": "string" },
          "description": "User-visible error messages or error summaries."
        },
        "warnings": {
          "type": "array",
          "items": { "type": "string" },
          "description": "Non-blocking warnings or notices."
        },
        "notifications": {
          "type": "array",
          "items": { "type": "string" },
          "description": "Informational notifications presented on this surface."
        },
        "test_cases": {
          "type": "array",
          "items": {
            "type": "object",
            "required": ["name"],
            "properties": {
              "name": { "type": "string" },
              "errors": { "type": "array", "items": { "type": "string" } },
              "expected": { "type": "object", "additionalProperties": true },
              "intent_type": { "type": "string", "enum": ["INFORM", "COLLECT", "AUTHORIZE", "ESCALATE", "RESULT"] },
              "escalation_channel": { "type": "string", "enum": ["in_app", "sms", "email", "push", "voice"] }
            },
            "additionalProperties": false
          }
        }
      },
      "additionalProperties": true
    }
  },
  "additionalProperties": false
}
