{
  "automation_policy": "forbidden",
  "aom_version": "0.1.0",
  "surface_id": "app:policy:no_automation",
  "surface_kind": "screen",
  "generated_at": "2025-01-01T00:00:00Z",
  "purpose": {
    "primary_goal": "Declare that this page must not be automated by agents.",
    "user_roles": ["anonymous", "guest"]
  },
  "context": {
    "app_name": "Example",
    "locale": "en-US"
  },
  "tasks": [],
  "entities": {},
  "actions": [],
  "state": {},
  "navigation": {},
  "signals": {}
}
